{
  "url": "https://newsapi.org/v2/everything",
  "api-key": {
    "alias": "apiKey",
    "value": "ee68362d0c8d492b9f525e5bc0d3989b"
  },
  "parameters": {
    "query": {
      "alias": "q",
      "required": true
    },
    "language": {
      "default": "en"
    },
    "page": {
      "default": 1
    },
    "pageSize": {
      "default": 1
    }
  },
  "message": "Here's the closest match I could find out of {totalResults} results. The article, published by {articles[0].source.name}, is titled \"{articles[0].title}\" and is written by {articles[0].author}. {articles[0].description}. The full article can be found on the {articles[0].source.name} website. Would you like to go there now?",
  "metadata": {
    "articles[0].url": "url",
    "articles[0].urlToImage": "image"
  }
}