{
  "url": "https://api.openweathermap.org/data/2.5/weather",
  "api-key": {
    "alias": "appid",
    "value": "a19ed1a7f194054f0458cb07ba18c0c3"
  },
  "parameters": {
    "city": {
      "alias": "q",
      "default": "london"
    },
    "language": {
      "alias": "lang",
      "default": "en",
      "required": false
    }
  },
  "message": "The weather in {name} today is {weather[0].description} with the temperature being {main.temp} degrees celsius but will probably feel like {main.feels_like} degrees celsius. The high will be {main.temp_max} degrees celsius and the low, {main.temp_min} degrees celsius.",
  "error_code_name": "cod",
  "error_messages": {
    "404": "Could not find ...",
    "default": "I'm sorry, I could not find any weather information."
  },
  "metadata": {
    "data": {
      "custom": true,
      "children": {
        "wind.speed": "wind_speed",
        "coord.lat": "latitude",
        "coord.lon": "longitude"
      }
    },
    "weather[0]": "basic_weather_data"
  }
}